{"artifact_status":"test-only","bundle_digest":"sha256:12c83f526d37640f54080428246e7a93238edaa84bdda1a4339882def9cfe690","digest_bindings":{"evidence_output_digest":"sha256:cccccccccccccccccccccccccccccccccccccccccccccccccccccccccccccccc","export_profile_digest":"sha256:aba1d03acbabad81aaa7c96a8daa64c4e38a9514f155c3aad24ce01ae4f4cc0b","exported_evidence_record_digest":"sha256:58edf4d37128eb613c3a31135b9cedad44c698ffa519f03c95db3ad2ad5f3c33","exporter_implementation_digest":"sha256:7cbf80f03e47553498b6e420516a0a0e63528c7edf5cb2cb137f8c4f7ab7088d","input_candidate_digest":"sha256:8ea4f8638d6467d69a7ba66e1bbdfad4b53f8940120f58058f2e3593cb732bb3","private_source_revision_digest":"sha256:2222222222222222222222222222222222222222222222222222222222222222","protocol_conformance_suite_digest":"sha256:19d2218c11c6ac7ba1d2f0884ba9e3c79cbd1264bd3ef682e543bcb9a63ccf0f","protocol_message_registry_digest":"sha256:2ff1685ca4325a0ff3bd49c7a411cd7f0857add6215c2f285097bdf40dcbc2b6","protocol_source_revision_digest":"sha256:dba1e8d6efc6083c62c2e4b44f6e12eaa4f5c6cb5ff0cd047a9ad3df0306a208","protocol_state_machine_digest":"sha256:42e63b8a1f413e932e46370aae5fa0d972f3ab71d93efe08557472b4c7066fe8","source_evidence_record_digest":"sha256:cb857ab45747fd1644bb9343836ba752b448c7a158572e6ab6e246d1be138da7","source_evidence_set_digest":"sha256:3333333333333333333333333333333333333333333333333333333333333333","subject_artifact_digest":"sha256:aaaaaaaaaaaaaaaaaaaaaaaaaaaaaaaaaaaaaaaaaaaaaaaaaaaaaaaaaaaaaaaa"},"evidence_record":{"completed_at":"2026-07-21T01:00:30Z","configuration":{"configuration_id":"test-only","model":"synthetic-bounded-model"},"execution":{"ran":true,"reason":null,"required":true},"id":"PM-EVIDENCE-1010","input_digests":["sha256:bbbbbbbbbbbbbbbbbbbbbbbbbbbbbbbbbbbbbbbbbbbbbbbbbbbbbbbbbbbbbbbb"],"lifecycle":"sanitized","lifecycle_history":[{"recorded_at":"2026-07-21T01:00:00Z","review_digest":null,"state":"collected"},{"recorded_at":"2026-07-21T01:01:00Z","review_digest":"sha256:1111111111111111111111111111111111111111111111111111111111111111","state":"validated"},{"recorded_at":"2026-07-21T01:02:00Z","review_digest":"sha256:eeeeeeeeeeeeeeeeeeeeeeeeeeeeeeeeeeeeeeeeeeeeeeeeeeeeeeeeeeeeeeee","state":"sanitized"}],"limitations":["Synthetic fixture only; no production or customer evidence."],"model_check":{"explored_state_space":{"complete_within_bounds":true,"distinct_states":4,"generated_states":5,"maximum_depth":2},"properties":["SyntheticInvariant"],"state_space_bounds":{"constraints":["FixtureCount <= 2"],"max_depth":4,"max_states":20,"parameters":[{"kind":"integer-range","maximum":2,"minimum":1,"name":"FixtureCount","values":[]}]}},"output_digest":"sha256:cccccccccccccccccccccccccccccccccccccccccccccccccccccccccccccccc","private_source_metadata":null,"producer":{"identity":"synthetic-fixture-runner","type":"local-runner"},"public_artifacts":["reports/synthetic-evidence.json"],"record_type":"evidence","schema_version":"0.1","started_at":"2026-07-21T01:00:00Z","status":"pass","subject":{"digest":"sha256:aaaaaaaaaaaaaaaaaaaaaaaaaaaaaaaaaaaaaaaaaaaaaaaaaaaaaaaaaaaaaaaa","identifier":"synthetic-public-subject","type":"protocol","version":"0.1"},"summary":"Synthetic pass evidence retained without status conversion.","tool":{"name":"synthetic-fixture-tool","source":"reviewed-public-fixture","version":"0.1"},"type":"model-check"},"export_candidate_digest":"sha256:8ea4f8638d6467d69a7ba66e1bbdfad4b53f8940120f58058f2e3593cb732bb3","export_candidate_id":"PM-EXPORT-CANDIDATE-0010","export_profile":{"digest":"sha256:aba1d03acbabad81aaa7c96a8daa64c4e38a9514f155c3aad24ce01ae4f4cc0b","id":"private-match-public-evidence-export","version":"0.1"},"exporter":{"identity":"private-match-assurance/evidence-exporter","implementation_digest":"sha256:7cbf80f03e47553498b6e420516a0a0e63528c7edf5cb2cb137f8c4f7ab7088d","implementation_manifest_digest":"sha256:ddcd2207c769fa9e76961c8e366f002633ebe01e88a3d4bac2e92cd7ce38dbfc","version":"0.1"},"fixture_provenance":{"fixture_catalog_digest":"sha256:5c6e9a885c9634a74bf1ba363a2f12e4d929e97cc1c89b190eb51578ddeb45f8","fixture_id":"FIXTURE-MODEL-CHECK"},"omissions":[],"publication":{"automation_permitted":false,"status":"test-only"},"record_type":"public-evidence-export","review_provenance":[{"review_digest":"sha256:4444444444444444444444444444444444444444444444444444444444444444","reviewed_subject_digest":"sha256:972d0d44020c9df5d3d806cd2542196cd9b1c63897b49362fb88d0e0ae42552d","reviewer_role":"synthetic-reviewer","scope":"privacy","status":"approved"},{"review_digest":"sha256:5555555555555555555555555555555555555555555555555555555555555555","reviewed_subject_digest":"sha256:972d0d44020c9df5d3d806cd2542196cd9b1c63897b49362fb88d0e0ae42552d","reviewer_role":"synthetic-reviewer","scope":"security-boundary","status":"approved"},{"review_digest":"sha256:6666666666666666666666666666666666666666666666666666666666666666","reviewed_subject_digest":"sha256:972d0d44020c9df5d3d806cd2542196cd9b1c63897b49362fb88d0e0ae42552d","reviewer_role":"synthetic-reviewer","scope":"ip","status":"not-applicable"},{"review_digest":"sha256:7777777777777777777777777777777777777777777777777777777777777777","reviewed_subject_digest":"sha256:972d0d44020c9df5d3d806cd2542196cd9b1c63897b49362fb88d0e0ae42552d","reviewer_role":"synthetic-reviewer","scope":"vulnerability","status":"not-applicable"}],"review_requirements":{"final_publication_approval":"not-applicable-test-only","ip":"not-applicable","privacy":"approved","security_boundary":"approved","vulnerability":"not-applicable"},"review_subject_digest":"sha256:972d0d44020c9df5d3d806cd2542196cd9b1c63897b49362fb88d0e0ae42552d","sanitization_report":{"allowlist_result":"pass","checks_executed":["allowlist","candidate-schema","digest-bindings","evidence-schema","lifecycle-limit","path-boundary","prohibited-field-scan","prohibited-value-scan","review-gates","review-subject-binding","status-preservation","trusted-execution-mode","exporter-implementation-manifest"],"digest_binding_result":"pass","input_lifecycle":"validated","input_status":"pass","ip_review_marker":"not-applicable","outcome":"exported","output_lifecycle":"sanitized","output_status":"pass","privacy_review_marker":"approved","prohibited_field_scan_result":"pass","prohibited_value_scan_result":"pass","security_review_marker":"approved","status_preservation_result":"pass","vulnerability_review_marker":"not-applicable"},"schema_version":"0.1"}
