{"artifact_status":"test-only","bundle_digest":"sha256:f2672ef300945467a7656bf3f25ead46ea74394817a2cd179617f34514c9d696","digest_bindings":{"evidence_output_digest":"sha256:cccccccccccccccccccccccccccccccccccccccccccccccccccccccccccccccc","export_profile_digest":"sha256:aba1d03acbabad81aaa7c96a8daa64c4e38a9514f155c3aad24ce01ae4f4cc0b","exported_evidence_record_digest":"sha256:56778c8abc04056cdc979c9d38cf2ec5ad0479dfb9d89337024bc450dfe25a9b","exporter_implementation_digest":"sha256:2bb3b82c4a440ed6cdb3a39684ddc4fb2a9bdbe220878e779d7a1ed58d3ae543","input_candidate_digest":"sha256:3d06f9d068993abfb4161736e1c08073020c877fbd7d85970786e16d49b5f54a","private_source_revision_digest":"sha256:2222222222222222222222222222222222222222222222222222222222222222","protocol_conformance_suite_digest":"sha256:19d2218c11c6ac7ba1d2f0884ba9e3c79cbd1264bd3ef682e543bcb9a63ccf0f","protocol_message_registry_digest":"sha256:2ff1685ca4325a0ff3bd49c7a411cd7f0857add6215c2f285097bdf40dcbc2b6","protocol_source_revision_digest":"sha256:dba1e8d6efc6083c62c2e4b44f6e12eaa4f5c6cb5ff0cd047a9ad3df0306a208","protocol_state_machine_digest":"sha256:42e63b8a1f413e932e46370aae5fa0d972f3ab71d93efe08557472b4c7066fe8","source_evidence_record_digest":"sha256:c2a5602525480bf67b4acb76efcedaa806725ad59f2235a2ee8980698aac0ea2","source_evidence_set_digest":"sha256:3333333333333333333333333333333333333333333333333333333333333333","subject_artifact_digest":"sha256:aaaaaaaaaaaaaaaaaaaaaaaaaaaaaaaaaaaaaaaaaaaaaaaaaaaaaaaaaaaaaaaa"},"evidence_record":{"completed_at":"2026-07-21T01:00:30Z","configuration":{"review_method":"fixture","review_scope":"synthetic-export-boundary"},"execution":{"ran":true,"reason":null,"required":true},"id":"PM-EVIDENCE-1009","input_digests":["sha256:bbbbbbbbbbbbbbbbbbbbbbbbbbbbbbbbbbbbbbbbbbbbbbbbbbbbbbbbbbbbbbbb"],"lifecycle":"sanitized","lifecycle_history":[{"recorded_at":"2026-07-21T01:00:00Z","review_digest":null,"state":"collected"},{"recorded_at":"2026-07-21T01:01:00Z","review_digest":"sha256:1111111111111111111111111111111111111111111111111111111111111111","state":"validated"},{"recorded_at":"2026-07-21T01:02:00Z","review_digest":"sha256:eeeeeeeeeeeeeeeeeeeeeeeeeeeeeeeeeeeeeeeeeeeeeeeeeeeeeeeeeeeeeeee","state":"sanitized"}],"limitations":["Synthetic fixture only; no production or customer evidence."],"model_check":null,"output_digest":"sha256:cccccccccccccccccccccccccccccccccccccccccccccccccccccccccccccccc","private_source_metadata":null,"producer":{"identity":"synthetic-fixture-runner","type":"local-runner"},"public_artifacts":[],"record_type":"evidence","schema_version":"0.1","started_at":"2026-07-21T01:00:00Z","status":"pass","subject":{"digest":"sha256:aaaaaaaaaaaaaaaaaaaaaaaaaaaaaaaaaaaaaaaaaaaaaaaaaaaaaaaaaaaaaaaa","identifier":"synthetic-public-subject","type":"protocol","version":"0.1"},"summary":"Synthetic pass evidence retained without status conversion.","tool":{"name":"synthetic-fixture-tool","source":"reviewed-public-fixture","version":"0.1"},"type":"review"},"export_candidate_digest":"sha256:3d06f9d068993abfb4161736e1c08073020c877fbd7d85970786e16d49b5f54a","export_candidate_id":"PM-EXPORT-CANDIDATE-0009","export_profile":{"digest":"sha256:aba1d03acbabad81aaa7c96a8daa64c4e38a9514f155c3aad24ce01ae4f4cc0b","id":"private-match-public-evidence-export","version":"0.1"},"exporter":{"identity":"private-match-assurance/evidence-exporter","implementation_digest":"sha256:2bb3b82c4a440ed6cdb3a39684ddc4fb2a9bdbe220878e779d7a1ed58d3ae543","implementation_manifest_digest":"sha256:a46de8010cf0a8f0dad48439b1d517e1d930b3f6b37895cdae0adc5664f438cb","version":"0.1"},"fixture_provenance":{"fixture_catalog_digest":"sha256:5c6e9a885c9634a74bf1ba363a2f12e4d929e97cc1c89b190eb51578ddeb45f8","fixture_id":"FIXTURE-APPROVED-OMISSION"},"omissions":[{"action":"omitted-by-profile","category":"optional-public-reference","human_review_digest":"sha256:ffffffffffffffffffffffffffffffffffffffffffffffffffffffffffffffff","path":"$.evidence_record.public_artifacts","rule_id":"OMIT-PUBLIC-ARTIFACTS"}],"publication":{"automation_permitted":false,"status":"test-only"},"record_type":"public-evidence-export","review_provenance":[{"review_digest":"sha256:4444444444444444444444444444444444444444444444444444444444444444","reviewed_subject_digest":"sha256:d969d411c80f156a6518645b65e5a16cf9713f6f076af30e6b4c5edfa23949e8","reviewer_role":"synthetic-reviewer","scope":"privacy","status":"approved"},{"review_digest":"sha256:5555555555555555555555555555555555555555555555555555555555555555","reviewed_subject_digest":"sha256:d969d411c80f156a6518645b65e5a16cf9713f6f076af30e6b4c5edfa23949e8","reviewer_role":"synthetic-reviewer","scope":"security-boundary","status":"approved"},{"review_digest":"sha256:6666666666666666666666666666666666666666666666666666666666666666","reviewed_subject_digest":"sha256:d969d411c80f156a6518645b65e5a16cf9713f6f076af30e6b4c5edfa23949e8","reviewer_role":"synthetic-reviewer","scope":"ip","status":"not-applicable"},{"review_digest":"sha256:7777777777777777777777777777777777777777777777777777777777777777","reviewed_subject_digest":"sha256:d969d411c80f156a6518645b65e5a16cf9713f6f076af30e6b4c5edfa23949e8","reviewer_role":"synthetic-reviewer","scope":"vulnerability","status":"not-applicable"}],"review_requirements":{"final_publication_approval":"not-applicable-test-only","ip":"not-applicable","privacy":"approved","security_boundary":"approved","vulnerability":"not-applicable"},"review_subject_digest":"sha256:d969d411c80f156a6518645b65e5a16cf9713f6f076af30e6b4c5edfa23949e8","sanitization_report":{"allowlist_result":"pass","checks_executed":["allowlist","candidate-schema","digest-bindings","evidence-schema","lifecycle-limit","path-boundary","prohibited-field-scan","prohibited-value-scan","review-gates","review-subject-binding","status-preservation","trusted-execution-mode","exporter-implementation-manifest"],"digest_binding_result":"pass","input_lifecycle":"validated","input_status":"pass","ip_review_marker":"not-applicable","outcome":"exported","output_lifecycle":"sanitized","output_status":"pass","privacy_review_marker":"approved","prohibited_field_scan_result":"pass","prohibited_value_scan_result":"pass","security_review_marker":"approved","status_preservation_result":"pass","vulnerability_review_marker":"not-applicable"},"schema_version":"0.1"}
